[
  {
    "id": "media-newsbreak-2026-09-14",
    "publication": "NewsBreak",
    "title": "Trine University Under Scrutiny for Foreign Student Recruitment Practices",
    "reference_type": "article",
    "published_at": "2026-09-14",
    "url": "https://www.newsbreak.com/news/4885662482992-trine-university-under-scrutiny-for-foreign-student-recruitment-practices",
    "author": null,
    "country": null,
    "provenance": "syndicated",
    "syndicated_from": "The UNN",
    "cited_work": "investigation",
    "context": "Staff Reporter. Syndication of The UNN piece, credits layoffhedge for the Trine investigation in prose and points to the @LayoffAI post that carried it. First NewsBreak citation.",
    "related_post_id": null,
    "featured": false,
    "logo": null,
    "archive_url": null,
    "notes": "Verified by the maintainer in a browser, 2026-09-19. newsbreak.com serves only a teaser; the full piece is The UNN's, which credits layoffhedge in prose and is recorded separately as media-the-unn-2026-09-14. The mention is therefore established on the syndicated original, not on this page's served text.",
    "status": "verified",
    "verified_at": "2026-09-19"
  },
  {
    "id": "media-the-unn-2026-09-14",
    "publication": "The UNN",
    "title": "Trine University Under Scrutiny for Foreign Student Recruitment Practices",
    "reference_type": "article",
    "published_at": "2026-09-14",
    "url": "https://theunn.com/trine-university-under-scrutiny-for-foreign-student-recruitment-practices/",
    "author": null,
    "country": "US",
    "provenance": "original",
    "syndicated_from": null,
    "cited_work": "investigation",
    "context": "Staff report. Credits the Trine investigation to layoffhedge in prose and points to the @LayoffAI post that carried it. First UNN citation.",
    "related_post_id": null,
    "featured": true,
    "logo": null,
    "archive_url": null,
    "notes": null,
    "status": "verified",
    "verified_at": "2026-09-19"
  },
  {
    "id": "media-hoosier-enquirer-2026-09-14",
    "publication": "Hoosier Enquirer",
    "title": "From Tri-State to Indiana's Third World University?",
    "reference_type": "article",
    "published_at": "2026-09-14",
    "url": "https://www.hoosierenquirer.com/post/the-other-trine-9-123-graduate-students-millions-for-recruiting-and-questions-indiana-deserves-a",
    "author": "Kelly Roberts",
    "country": "US",
    "provenance": "original",
    "syndicated_from": null,
    "cited_work": "investigation",
    "context": "The Indiana nonprofit newsroom builds its Trine reporting on LayoffHedge's investigation, naming layoffhedge three times and citing LayoffHedge's Form 990 findings on the Gurukul Overseas recruiting payments. First Hoosier Enquirer citation.",
    "related_post_id": null,
    "featured": true,
    "logo": null,
    "archive_url": null,
    "notes": null,
    "status": "verified",
    "verified_at": "2026-09-19"
  },
  {
    "id": "media-the-post-millennial-2026-09-13",
    "publication": "The Post Millennial",
    "title": "School accused of giving foreign students a back-door pathway to worker visas",
    "reference_type": "article",
    "published_at": "2026-09-13",
    "url": "https://thepostmillennial.com/trine-university-faces-scrutiny-over-programs-allowing-foreign-students-to-work-from-start-of-graduate-studies",
    "author": "Hayden Cunningham",
    "country": "CA",
    "provenance": "original",
    "syndicated_from": null,
    "cited_work": "investigation",
    "context": "Names LayoffHedge's Day 1 CPT investigation by title, embeds LayoffHedge's @LayoffAI post, and carries a Harmeet Dhillon post quote-tweeting LayoffHedge's card. First Post Millennial citation.",
    "related_post_id": null,
    "featured": true,
    "logo": null,
    "archive_url": null,
    "notes": "Verified on 2026-09-17 by retrieving the article and confirming it names layoffhedge or @LayoffAI in its text.",
    "status": "verified",
    "verified_at": "2026-09-17"
  },
  {
    "id": "media-the-american-bazaar-2026-09-13",
    "publication": "The American Bazaar",
    "title": "Trine University faces scrutiny over foreign student recruitment",
    "reference_type": "article",
    "published_at": "2026-09-13",
    "url": "https://americanbazaaronline.com/2026/09/13/trine-university-foreign-student-recruitment-488047/",
    "author": "Jayujyoti Mullick",
    "country": "US",
    "provenance": "original",
    "syndicated_from": null,
    "cited_work": "investigation",
    "context": "Credits LayoffHedge's Trine University investigation to layoffhedge in prose and embeds the @LayoffAI post. Seventh American Bazaar citation.",
    "related_post_id": null,
    "featured": true,
    "logo": null,
    "archive_url": null,
    "notes": null,
    "status": "verified",
    "verified_at": "2026-09-19"
  },
  {
    "id": "media-alex-jones-live-2026-09-07",
    "publication": "Alex Jones Live",
    "title": "Women Account for 98% of August Job Gains",
    "reference_type": "article",
    "published_at": "2026-09-07",
    "url": "https://www.alexjoneslive.com/2026/09/07/women-account-for-98-of-august-job-gains/",
    "author": null,
    "country": null,
    "provenance": "original",
    "syndicated_from": null,
    "cited_work": "none",
    "context": "Charles Cornish-Dale builds the piece around LayoffHedge's August jobs post, embedded in full. Third Alex Jones Live citation.",
    "related_post_id": null,
    "featured": false,
    "logo": null,
    "archive_url": null,
    "notes": null,
    "status": "verified",
    "verified_at": "2026-09-19"
  },
  {
    "id": "media-indiatimes-2026-09-02",
    "publication": "IndiaTimes",
    "title": "Saudi Arabia poured $5 billion into LIV Golf to challenge the PGA Tour, so why is it walking away?",
    "reference_type": "article",
    "published_at": "2026-09-02",
    "url": "https://www.indiatimes.com/trending/saudi-arabia-poured-5-billion-into-liv-golf-to-challenge-the-pga-tour-so-why-is-it-walking-away-shifting-global-markets-and-new-priorities-explained/articleshow/133691548.html",
    "author": null,
    "country": "IN",
    "provenance": "original",
    "syndicated_from": null,
    "cited_work": "none",
    "context": "Embeds LayoffHedge's LIV Golf post reporting that the tour told its 300-plus staff most of them finish next week. First IndiaTimes citation.",
    "related_post_id": null,
    "featured": false,
    "logo": null,
    "archive_url": null,
    "notes": "Verified on 2026-09-17 by retrieving the article and confirming it names layoffhedge or @LayoffAI in its text.",
    "status": "verified",
    "verified_at": "2026-09-17"
  },
  {
    "id": "media-geeks-gamers-2026-08-30",
    "publication": "Geeks + Gamers",
    "title": "Disney Executives Offered Lucrative Voluntary Retirement Packages Amid Mass Layoffs",
    "reference_type": "article",
    "published_at": "2026-08-30",
    "url": "https://geeksandgamers.com/disney-executives-offered-lucrative-voluntary-retirement-packages-amid-mass-layoffs/",
    "author": "Billy Oduory",
    "country": null,
    "provenance": "original",
    "syndicated_from": null,
    "cited_work": "none",
    "context": "First Geeks + Gamers citation. Embeds LayoffHedge's @LayoffAI post breaking the Disney executive buyout memo, which offered early retirement to US staff from director through EVP level and called it step one of much bigger cuts.",
    "related_post_id": null,
    "featured": false,
    "logo": null,
    "archive_url": null,
    "notes": null,
    "status": "verified",
    "verified_at": "2026-09-19"
  },
  {
    "id": "media-the-gateway-pundit-2026-08-27",
    "publication": "The Gateway Pundit",
    "title": "Trump's $100k Visa Application Fee Plan Is Back and This Time Dems Will Have a Harder Time Stopping It",
    "reference_type": "article",
    "published_at": "2026-08-27",
    "url": "https://www.thegatewaypundit.com/2026/08/trumps-100k-visa-application-fee-plan-back-time/",
    "author": "Samantha Chang",
    "country": "US",
    "provenance": "syndicated",
    "syndicated_from": "Western Journal",
    "cited_work": "none",
    "context": "Syndicated from The Western Journal. First Gateway Pundit citation. Embeds LayoffHedge's @LayoffAI post on H-4 dependent visas, which noted 214,596 H-1B visas issued in FY2025 alongside another 146,158 H-4 visas that carry no annual cap.",
    "related_post_id": null,
    "featured": false,
    "logo": null,
    "archive_url": null,
    "notes": "Verified on 2026-09-17 by retrieving the article and confirming it names layoffhedge or @LayoffAI in its text.",
    "status": "verified",
    "verified_at": "2026-09-17"
  },
  {
    "id": "media-western-journal-2026-08-26",
    "publication": "Western Journal",
    "title": "Trump's $100k Visa Application Fee Plan Is Back and This Time Dems Will Have a Harder Time Stopping It",
    "reference_type": "article",
    "published_at": "2026-08-26",
    "url": "https://www.westernjournal.com/trumps-100k-visa-application-fee-plan-back-time-dems-will-harder-time-stopping/",
    "author": "Samantha Chang",
    "country": "US",
    "provenance": "original",
    "syndicated_from": null,
    "cited_work": "none",
    "context": "Second Western Journal citation. Embeds LayoffHedge's @LayoffAI post on H-4 dependent visas, which noted 214,596 H-1B visas issued in FY2025 alongside another 146,158 H-4 visas, and that the H-4 category carries no annual cap.",
    "related_post_id": null,
    "featured": false,
    "logo": null,
    "archive_url": null,
    "notes": "Verified on 2026-09-17 by the maintainer: the article cites an @LayoffAI post. The site blocks automated requests.",
    "status": "verified",
    "verified_at": "2026-09-17"
  },
  {
    "id": "media-the-source-2026-08-25",
    "publication": "The Source",
    "title": "Disney Is Cutting Deeper at the Top as Early Retirement Offer Hits Longtime Executives",
    "reference_type": "article",
    "published_at": "2026-08-25",